{
  "schema_version": "0.1.0",
  "catalog": {
    "id": "grundschutzcheck.windows11.client",
    "title": "Windows 11 client checks for BSI IT-Grundschutz and Grundschutz++",
    "version": "0.1.0",
    "released": "2026-10-21",
    "description": "Read-only checks for a Windows 11 client. Requirement ids are copied from published BSI documents. Every windows11_carryover value is unverified because the setting values come from the Windows 10 Hilfsmittel.",
    "target": "Windows 11 client",
    "applicability_note": "Concrete values are carried over from Hilfsmittel zur Umsetzung der Anforderungen des IT-Grundschutz-Kompendiums fuer Windows-Clients, version 1.0, 20 February 2025, written for Windows 10 version 21H2 and later. BSI has not published a Windows 11 settings matrix. SYS.2.2.3 in the IT-Grundschutz-Kompendium Edition 2023 applies to Windows 10 and Windows 11. SiSyPHuS hardening checklists published by BSI address Windows 10 LTSC 2019 (1809). There is no published BSI Windows 11 SiSyPHuS matrix, so v0.1 does not score one.",
    "sources": [
      {
        "id": "bsi-hilfsmittel-windows-client-1.0",
        "title": "Hilfsmittel zur Umsetzung der Anforderungen des IT-Grundschutz-Kompendiums fuer Windows-Clients",
        "version": "1.0",
        "released": "2025-02-20",
        "url": "https://www.bsi.bund.de/SharedDocs/Downloads/DE/BSI/Grundschutz/Hilfsmittel/Hilfsmittel_IT_Grundschutz_Windows_Client.html"
      },
      {
        "id": "it-grundschutz-kompendium-2023",
        "title": "IT-Grundschutz-Kompendium Edition 2023",
        "version": "2023",
        "url": "https://www.bsi.bund.de/DE/Themen/Unternehmen-und-Organisationen/Standards-und-Zertifizierung/IT-Grundschutz/IT-Grundschutz-Kompendium/it-grundschutz-kompendium_node.html"
      },
      {
        "id": "grundschutz-plus-plus-2026-09-24",
        "title": "Anwenderkatalog Grundschutz++",
        "version": "2026-09-24T07:12:39.131983+00:00",
        "url": "https://github.com/BSI-Bund/Stand-der-Technik-Bibliothek/blob/main/control_layer/Grundschutz%2B%2B/Grundschutz%2B%2B-resolved_catalog.json"
      }
    ]
  },
  "modules": [
    {
      "id": "SYS.2.1",
      "title": "Allgemeiner Client"
    },
    {
      "id": "SYS.2.2.3",
      "title": "Clients unter Windows"
    },
    {
      "id": "DET.3",
      "title": "Detektion (Grundschutz++ practice DET.3, not a Kompendium Baustein)"
    }
  ],
  "checks": [
    {
      "id": "GS-W11-001",
      "title": "Password history remembers 24 passwords",
      "severity": "medium",
      "mapping": "verified",
      "windows11_carryover": "unverified",
      "module": {
        "id": "SYS.2.1"
      },
      "references": [
        {
          "framework": "it-grundschutz-kompendium",
          "requirement_id": "SYS.2.1.A1",
          "title": "Sichere Authentisierung von Benutzenden",
          "mapping": "verified",
          "source_id": "bsi-hilfsmittel-windows-client-1.0",
          "note": "Requirement from the IT-Grundschutz-Kompendium, Edition 2023. The setting value is taken from the BSI Hilfsmittel for Windows clients, version 1.0 (20 February 2025)."
        },
        {
          "framework": "grundschutz-plus-plus",
          "requirement_id": "BER.6.2",
          "title": "Blockieren von Passwort Recycling",
          "mapping": "verified",
          "source_id": "grundschutz-plus-plus-2026-09-24",
          "note": "The control requires blocking reuse and does not fix a history depth. Depth 24 is the Hilfsmittel value."
        }
      ],
      "rationale": "The Hilfsmittel sets Enforce password history to 24 passwords remembered. The concrete value is carried over from the Windows 10 Hilfsmittel (from Windows 10 version 21H2). BSI has not published a Windows 11 settings matrix. SYS.2.2.3 Edition 2023 applies to Windows 10 and Windows 11.",
      "conflict_note": "",
      "applicability_note": "secedit /export reads the local security database. On a domain member, account policy in that database does not govern domain accounts. Domain accounts follow the Default Domain Policy on a domain controller. v0.1 does not query a domain controller.",
      "evaluation": {
        "method": "secedit",
        "section": "System Access",
        "key": "PasswordHistorySize",
        "operator": "equals",
        "expected": 24
      },
      "remediation": {
        "summary": "Apply the Group Policy or the snippet below. v0.1 does not apply this change.",
        "gpo": "Computer Configuration/Windows Settings/Security Settings/Account Policies/Password Policy\nEnforce password history: 24 passwords remembered",
        "intune": "Settings Catalog mirrors this Group Policy path:\nComputer Configuration/Windows Settings/Security Settings/Account Policies/Password Policy\nNo OMA-URI is cited because it was not confirmed for this setting.",
        "registry": "; Security template fragment for secedit. This is not a Registry Editor file.\n; On a domain member, account policy here does not govern domain accounts.\n\n[System Access]\nPasswordHistorySize = 24\n"
      }
    },
    {
      "id": "GS-W11-002",
      "title": "Minimum password length is at least 10 characters",
      "severity": "medium",
      "mapping": "verified",
      "windows11_carryover": "unverified",
      "module": {
        "id": "SYS.2.1"
      },
      "references": [
        {
          "framework": "it-grundschutz-kompendium",
          "requirement_id": "SYS.2.1.A1",
          "title": "Sichere Authentisierung von Benutzenden",
          "mapping": "verified",
          "source_id": "bsi-hilfsmittel-windows-client-1.0",
          "note": "Requirement from the IT-Grundschutz-Kompendium, Edition 2023. The setting value is taken from the BSI Hilfsmittel for Windows clients, version 1.0 (20 February 2025). Option 2 in the Hilfsmittel is 10 to 12 characters. Option 1 (passphrase) is 20 to 25. The scored floor is 10 so both options pass."
        },
        {
          "framework": "grundschutz-plus-plus",
          "requirement_id": "BER.6.4",
          "title": "Kriterien für die Qualität von Passwörtern",
          "mapping": "unverified",
          "source_id": "grundschutz-plus-plus-2026-09-24",
          "note": "Guidance says a length under 14 is not recommended when no other measures exist. 10 is weaker than that sentence, so this citation is unverified."
        }
      ],
      "rationale": "Password complexity is not scored on its own. The passphrase option wants complexity disabled, and the complex-password option wants it enabled. The concrete value is carried over from the Windows 10 Hilfsmittel (from Windows 10 version 21H2). BSI has not published a Windows 11 settings matrix. SYS.2.2.3 Edition 2023 applies to Windows 10 and Windows 11.",
      "conflict_note": "Grundschutz++ BER.6.4 says a length under 14 is not recommended when no other measures are in place. This check uses the Hilfsmittel floor of 10 so option 2 is not failed. The BER.6.4 citation is unverified.",
      "applicability_note": "secedit /export reads the local security database. On a domain member, account policy in that database does not govern domain accounts. Domain accounts follow the Default Domain Policy on a domain controller. v0.1 does not query a domain controller.",
      "evaluation": {
        "method": "secedit",
        "section": "System Access",
        "key": "MinimumPasswordLength",
        "operator": "greater_or_equal",
        "expected": 10
      },
      "remediation": {
        "summary": "Apply the Group Policy or the snippet below. v0.1 does not apply this change.",
        "gpo": "Computer Configuration/Windows Settings/Security Settings/Account Policies/Password Policy\nMinimum password length: at least 10 (Hilfsmittel option 2 is 10-12; option 1 is 20-25)",
        "intune": "Settings Catalog mirrors this Group Policy path:\nComputer Configuration/Windows Settings/Security Settings/Account Policies/Password Policy\nNo OMA-URI is cited because it was not confirmed for this setting.",
        "registry": "; Security template fragment for secedit. This is not a Registry Editor file.\n; On a domain member, account policy here does not govern domain accounts.\n\n[System Access]\nMinimumPasswordLength = 10\n"
      }
    },
    {
      "id": "GS-W11-003",
      "title": "Minimum password age is at least 1 day",
      "severity": "medium",
      "mapping": "verified",
      "windows11_carryover": "unverified",
      "module": {
        "id": "SYS.2.1"
      },
      "references": [
        {
          "framework": "it-grundschutz-kompendium",
          "requirement_id": "SYS.2.1.A1",
          "title": "Sichere Authentisierung von Benutzenden",
          "mapping": "verified",
          "source_id": "bsi-hilfsmittel-windows-client-1.0",
          "note": "Requirement from the IT-Grundschutz-Kompendium, Edition 2023. The setting value is taken from the BSI Hilfsmittel for Windows clients, version 1.0 (20 February 2025)."
        }
      ],
      "rationale": "The Hilfsmittel sets Minimum password age to 1 day so a user cannot cycle the history in one sitting. The concrete value is carried over from the Windows 10 Hilfsmittel (from Windows 10 version 21H2). BSI has not published a Windows 11 settings matrix. SYS.2.2.3 Edition 2023 applies to Windows 10 and Windows 11.",
      "conflict_note": "",
      "applicability_note": "secedit /export reads the local security database. On a domain member, account policy in that database does not govern domain accounts. Domain accounts follow the Default Domain Policy on a domain controller. v0.1 does not query a domain controller.",
      "evaluation": {
        "method": "secedit",
        "section": "System Access",
        "key": "MinimumPasswordAge",
        "operator": "greater_or_equal",
        "expected": 1
      },
      "remediation": {
        "summary": "Apply the Group Policy or the snippet below. v0.1 does not apply this change.",